{
  "schema_version": "1.0",
  "record_id": "local-ollama-001",
  "record_type": "model.usage",
  "start_time": "2026-07-06T12:35:00Z",
  "end_time": "2026-07-06T12:35:01.200000Z",
  "source": { "service": "claims-agent", "environment": "development" },
  "attribution": { "team_id": "claims", "project_id": "claims-automation", "workflow_id": "claim-review" },
  "model": {
    "provider": "ollama",
    "requested_model": "qwen2.5:3b",
    "response_model": "qwen2.5:3b",
    "hosting": "local_device",
    "endpoint_classification": "self_hosted",
    "pricing_key": "qwen2.5:3b"
  },
  "usage": {
    "input_tokens": 900,
    "output_tokens": 120,
    "cached_input_tokens": 0,
    "cached_output_tokens": 0,
    "reasoning_tokens": 0,
    "audio_input_tokens": 0,
    "audio_output_tokens": 0,
    "image_input_units": 0,
    "total_tokens": 1020
  },
  "performance": { "latency_ms": 1200, "retries": 0, "status": "success" },
  "cost": {
    "currency": "USD",
    "provider_cost": "0.000000",
    "infrastructure_cost": "0.000083",
    "allocated_cost": "0.000000",
    "total_cost": "0.000083",
    "calculation_method": "local_resource_estimate",
    "pricing_version": "local-rtx-workstation"
  },
  "outcome": { "outcome_id": "claim-review-success", "success": true, "quantity": "1", "unit": "completed_claim" },
  "metadata": { "offline_example": true }
}
